{
  "$schema": "https://json-schema.org/draft/2020-12/schema",
  "$id": "https://schemas.jlaudio.local/jl-mixing/v1.1/client.schema.json",
  "title": "JL Mixing Client Profile v1.1",
  "type": "object",
  "required": [
    "metadata",
    "client_id",
    "client_name",
    "defaults"
  ],
  "properties": {
    "metadata": {
      "type": "object",
      "required": [
        "schema",
        "schema_version",
        "document_id",
        "created_with",
        "created_at",
        "last_modified_at"
      ],
      "properties": {
        "schema": {
          "const": "mixing-client"
        },
        "schema_version": {
          "const": "1.1.0"
        },
        "document_id": {
          "type": "string",
          "format": "uuid"
        },
        "created_with": {
          "type": "string",
          "pattern": "^jl-mixing [0-9]+\\.[0-9]+\\.[0-9]+(?:-[0-9A-Za-z.-]+)?(?:\\+[0-9A-Za-z.-]+)?$"
        },
        "created_at": {
          "type": "string",
          "format": "date-time"
        },
        "last_modified_at": {
          "type": "string",
          "format": "date-time"
        }
      },
      "additionalProperties": false
    },
    "client_id": {
      "type": "string",
      "pattern": "^[a-z0-9]+(?:-[a-z0-9]+)*$"
    },
    "client_name": {
      "type": "string",
      "pattern": "\\S"
    },
    "defaults": {
      "type": "object",
      "required": [
        "artist",
        "audio",
        "delivery"
      ],
      "properties": {
        "artist": {
          "type": "string"
        },
        "audio": {
          "type": "object",
          "required": [
            "sample_rate",
            "bit_depth",
            "file_format"
          ],
          "properties": {
            "sample_rate": {
              "type": "integer",
              "enum": [
                44100,
                48000,
                88200,
                96000,
                176400,
                192000
              ]
            },
            "bit_depth": {
              "type": "integer",
              "enum": [
                16,
                24,
                32
              ]
            },
            "file_format": {
              "type": "string",
              "enum": [
                "WAV",
                "AIFF"
              ]
            }
          },
          "additionalProperties": false
        },
        "delivery": {
          "type": "object",
          "required": [
            "method",
            "requested_deliverables"
          ],
          "properties": {
            "method": {
              "type": "string",
              "pattern": "\\S"
            },
            "requested_deliverables": {
              "type": "array",
              "minItems": 1,
              "uniqueItems": true,
              "items": {
                "type": "string",
                "enum": [
                  "main_mix",
                  "instrumental",
                  "acapella",
                  "tv_mix",
                  "performance_mix",
                  "stems",
                  "master"
                ]
              }
            }
          },
          "additionalProperties": false
        }
      },
      "additionalProperties": false
    }
  },
  "additionalProperties": false
}
