{
  "metadata": {
    "schema": "mixing-client",
    "schema_version": "1.1.0",
    "document_id": "22222222-2222-4222-8222-222222222222",
    "created_with": "jl-mixing 1.1.0",
    "created_at": "2026-07-14T20:05:00-04:00",
    "last_modified_at": "2026-07-14T20:05:00-04:00"
  },
  "client_id": "acme",
  "client_name": "Acme Records",
  "defaults": {
    "artist": "The Example Band",
    "audio": {
      "sample_rate": 48000,
      "bit_depth": 24,
      "file_format": "WAV"
    },
    "delivery": {
      "method": "Cloud transfer",
      "requested_deliverables": [
        "main_mix",
        "instrumental"
      ]
    }
  }
}
